title,description,author,isbn,price
Planet of the Ultra Demon,Dignissimos minima veniam optio quasi odit possimus ullam. Numquam minus id odio ea sequi esse. Quos exercitationem labore ipsa aut.,Ute Nienow,1019462146,909.9
Day of the Flying Cousins,Distinctio suscipit eligendi iure ipsam dicta odit. Voluptate mollitia laudantium consectetur nam iusto velit. Fugit et quasi veritatis voluptatem iusto facere architecto minus. Error accusantium non minus optio.,Dorris Sporer,1163075717,605.0
Codename: Forbidden Wizard,Dolores deserunt sequi nemo numquam accusamus. Excepturi reiciendis in vel quia nulla accusantium. Architecto deserunt sit molestias provident suscipit nobis sed exercitationem. Labore voluptates sint iusto neque fugit atque.,Odessa Roob,5297457945,883.8
Season of the Hungry Mutant,Reiciendis architecto nemo debitis harum id libero ratione deleniti. Cumque eligendi asperiores magni mollitia vero consectetur ratione. Dolor quaerat dolore tenetur omnis corporis odit.,Daine Schimmel,3197205320,588.2
Curse of the Fake Dreams,Dolor voluptatum sint beatae unde culpa debitis ex hic. Fugit eaque tempora nulla eius reiciendis est perspiciatis. Veritatis nam facere recusandae fugit quas id.,Lillian Kuphal,15375439017,247.2
